tag,title,price
[국내도서],스무디 한 잔 마시며 끝내는 React Native,"27,000원"
[국내도서],빠른 모바일 앱 개발을 위한 React Native 리액트 네이티브 2/E,"21,600원"
[eBook],스무디 한 잔 마시며 끝내는 React Native : React Native로 실전 스마트폰 앱 만들기,"24,000원"
[국내도서],리액트를 다루는 기술,"37,800원"
[국내도서],React 16 Tooling,"27,000원"
[국내도서],리액트 머티리얼 UI 쿡북,"36,000원"
[eBook],리액트를 다루는 기술(개정판),"29,400원"
[국내도서],Do it! 리액트 프로그래밍 정석,"32,400원"
[국내도서],React 16 핵심 정리 2/e,"22,500원"
[국내도서],리액트 네이티브 인 액션,"22,500원"
[국내도서],Go 풀스택 웹 개발,"27,000원"
[국내도서],리액트,"11,250원"
[외국도서],How NGOs React (Paperback),"32,080원"
[eBook],Do it! 리액트 프로그래밍 정석,"23,000원"
[국내도서],리액트 & 리액트 네이티브 통합 교과서,"31,500원"
[국내도서],리액트 교과서,"32,400원"
[국내도서],리액트 16,"40,500원"
[국내도서],러닝 리액트,"25,200원"
[국내도서],실전 리액트 프로그래밍,"28,800원"
[국내도서],프론트엔드 개발 첫걸음,"16,200원"
[국내도서],파이썬과 리액트를 활용한 주식 자동거래 시스템 구축,"25,200원"
[국내도서],더 괜찮은 웹 개발자가 되기 위한 리액트 스타일 가이드,"22,500원"
[국내도서],모던 리액트/리덕스 프로그래밍,"22,500원"
[외국도서],"JavaScript Everywhere: Building Cross-Platform Applications with Graphql, React, React Native, and Electron (Paperback)","57,380원"
[외국도서],Learn React with Typescript 3 (Paperback),"51,640원"
[외국도서],Cloud Native Go: Building Web Applications and Microservices for the Cloud with Go and React (Paperback),"45,900원"
[외국도서],Fullstack React Native: Create Beautiful Mobile Apps with JavaScript and React Native (Paperback),"67,730원"
[외국도서],React Native in Action (Paperback),"62,980원"
[국내도서],리액트 인 액션,"25,200원"
[eBook],리액트,"8,500원"
[eBook],프론트엔드 개발 첫걸음,"12,000원"
[eBook],리액트 개발을 위한 모던 자바스크립트,"8,000원"
[외국도서],React js: Apprendre ReactJS de la base ?la ma?rise (Paperback),"19,490원"
[외국도서],"React js: Hands-On full stack web development using React js, 2nd Edition (Paperback)","19,490원"
[외국도서],"Learning React js: Learn React JS From Scratch with Hands-On Projects, 2nd Edition (Paperback)","16,220원"
[외국도서],"React js For Beginners: Learning React js Library From Scratch, 1st Edition (Paperback)","17,200원"
[외국도서],React and Libraries: Your Complete Guide to the React Ecosystem (Paperback),"47,690원"
[외국도서],Beginning React (incl. Redux and React Hooks) (Paperback),"19,490원"
[외국도서],Beginning Ethereum and Solidity with React (Paperback),"19,490원"
[외국도서],Learning React js: A complete hands-on guide to modern web development with React.js (Paperback),"20,640원"
[외국도서],Don't Over React! WITH BLACK AND WHITE CONTENT: An entertaining guide to help you succeed in college-level general chemistry First Semester (Paperback),"11,420원"
[외국도서],Building Versatile Mobile Apps with Python and Rest: Restful Web Services with Django and React (Paperback),"47,690원"
[외국도서],React js: Unmatched power for building fast and secure apps (Paperback),"19,490원"
[외국도서],Sometimes It's Better To React With No Reaction Adult Coloring Book: 50+ Unique Designs Motivation Coloring Book for Stress-Relief. With Inspiring quo (Paperback),"8,010원"
[외국도서],React Native ~JavaScriptによるiOS/Androidアプリ開?の實踐,"53,060원"
[외국도서],React js: Modern web development using React js - for Beginners - 2020 (Paperback),"19,490원"
[외국도서],"How To Invest In The Stock Market: 4 Different Strategies Analyzed In Depth, How You Should React To Different Market Cycles, The Right Mindset That T (Paperback)","17,200원"
[외국도서],EJERCICIOS PRACTICOS CON REACT (Paperback),"79,410원"
[외국도서],ALL people have adversity. What separates the good from the great is how we choose to react to it. Journal: A minimalistic Lined Journal / Notebook /J (Paperback),"9,160원"
[외국도서],"It's not what happens to you, but how you react to it that matters, Journal, Notebook, Funny: Things I Want to Say Out Loud But Can't: Blank Lined Cow (Paperback)","6,570원"
[외국도서],"Trust Me, I'm a React Developer: Dot Grid Notebook - 6 x 9 inches, 110 Pages - Tailored, Professional IT, Office Softcover Journal (Paperback)","6,870원"
[외국도서],"REACT(初回限定映像盤)(DVD付) CD+DVD, 限定版","33,700원"
[외국도서],"Modern Full-Stack Development: Using Typescript, React, Node.Js, Webpack, and Docker (Paperback)","44,960원"
[외국도서],Cats React to Outer Space Facts (Hardcover),"19,700원"
[외국도서],"Life is 10% what happens to me and 90% of how I react to it.: Marble Design 100 Pages Large Size 8.5"" X 11"" Inches Gratitude Journal And Productivity (Paperback)","19,490원"
[외국도서],"Life is 10% what happens to me and 90% of how I react to it.: College Ruled Marble Design 100 Pages Large Size 8.5"" X 11"" Inches Matte Notebook (Paperback)","19,490원"
[외국도서],Learn React Hooks (Paperback),"45,000원"
[외국도서],I Love React JS - Coding Notebook: Blank Lined Journal for Programmers - Ideal Companion for Developers & Designers - Perfect Gift for Software Engine (Paperback),"7,400원"
[외국도서],"You Amplify Everything You React To: A softcover blank lined journal to jot down ideas, memories, goals, and anything else that comes to mind. (Paperback)","8,010원"
[외국도서],"Mastering React Test-Driven Development : Build rock-solid, well-tested web apps with React, Redux and GraphQL (Paperback)","50,000원"
[외국도서],Learning React: Modern Patterns for Developing React Apps (Paperback),"68,860원"
[외국도서],The Friends and Foes of Jesus: Discover How People in the New Testament React to God's Good News (Paperback),"14,900원"
[외국도서],"React Native開發指南 (平裝, 1st)","39,330원"
[외국도서],Scorpio - Just because I don't react doesn't mean I don't notice: Scorpio Star Sign Horoscope Notebook Blank Lined Journal Gift For An Astrology Zodia (Paperback),"7,970원"
[외국도서],Pro React 16 (Paperback),"61,320원"
[외국도서],React Native Cookbook (Paperback),"53,000원"
[외국도서],The Road to React: Your journey to master plain yet pragmatic React.js (Paperback),"34,420원"
[외국도서],"React设計模式與最佳實踐 (平裝, 第1版)","33,630원"
[외국도서],"快速上手React编程 (平裝, 第1版)","50,160원"
[외국도서],Practical React Native: Build Two Full Projects and One Full Game Using React Native (Paperback),"40,870원"
[외국도서],"JavaScript Applications with Node.Js, React, React Native and Mongodb: Design, Code, Test, Deploy and Manage in Amazon Aws (Paperback)","28,700원"
[외국도서],React開發 現場の敎科書 (單行本(ソフトカバ-)),"46,520원"
[외국도서],React入門 React·Reduxの導入からサ-バサイドレンダリングによるUXの向上まで (NEXT-ONE) (單行本),"39,720원"
[외국도서],"Controlling Your Anger: Learn How to Respond, Not React (Paperback)","12,610원"
[외국도서],React 16 Essentials (Paperback),"34,420원"
[외국도서],".Net Knowledge Book: Typescript, React and Nodejs (Paperback)","19,490원"
[외국도서],"React(第2版):引領未來的用戶界面開發框架 (平裝, 第2版)","39,330원"
[외국도서],"React:引領未來的用戶界面開發框架 (平裝, 第1版)","37,050원"
[외국도서],"移動Web前端高效開發實戰:HTML 5+CSS 3+JavaScript+Webpack+React Native+Vue.js+Node.js (平裝, 第1版)","50,730원"
[외국도서],React Native Blueprints (Paperback),"51,640원"
[외국도서],"Journal: Life Is 10% What Happens to You and 90% How You React to It: Lined Journal, 120 Pages, 5.5 X 8.5, Inspirational Quotat (Paperback)","9,160원"
[외국도서],"Cross-Platform Desktop Application Development: Electron, Node, NW.Js, and React (Paperback)","32,000원"
[외국도서],"React for Real: Front-End Code, Untangled (Paperback)","30,930원"
[외국도서],React Native Cookbook: Bringing the Web to Native Platforms (Paperback),"45,900원"
[외국도서],"Learning React: A Hands-On Guide to Building Web Applications Using React and Redux (Paperback, 2)","45,900원"
[외국도서],React in Action (Paperback),"51,640원"
[외국도서],Webデベロッパ-のためのReact開發入門 JavaScript UIライブラリの基本と活用 (單行本(ソフトカバ-)),"33,330원"
[외국도서],React Components (Paperback),"40,160원"
[외국도서],Survivejs - Webpack and React: From Apprentice to Master (Paperback),"22,940원"
[외국도서],Learning React (Paperback),"45,900원"
[외국도서],Getting Started with React Native (Paperback),"34,420원"
[외국도서],Understanding Krav Maga: Learn How to React to Any Type of Threat Without Hesitation! (Paperback),"14,900원"
[외국도서],Pro React (Paperback),"47,690원"
[외국도서],React: Up & Running: Building Web Applications (Paperback),"45,900원"
[외국도서],It's Time to React--Reauthorizing Executive Authority to Consolidate Task: Establishing Results and Sunset Commissions (Paperback),"22,670원"
[외국도서],Grasping the Thistle : How Scotland Must React to the Three Key Challenges of the Twenty First Century (Paperback),"12,110원"
[외국도서],Osmotischer Druck Und Ionenlehre in Den Medicinischen Wissenschaften: Circulirendes Blut. Lymphbildung. Hydrops. Resorption. Harn Und Sonstige . React (Paperback),"75,570원"
[외국도서],ORGANOMET REACT 05 (Hardcover),"112,630원"
[외국도서],IE PORT LIT RDG REACT WRTG 8E (Paperback),"71,590원"
[외국도서],"Everyday Heroes : The Best of Today's Teenagers from ""React"" Magazine (Hardcover)","68,260원"
[외국도서],TB CHEM CHEM REACT 7E (Paperback),"68,240원"
[외국도서],ORGANOMET REACT 04 (Hardcover),"112,630원"
[외국도서],Network Security Traceback Attack and React in the United States Department of Defense Network (Paperback),"74,620원"
[외국도서],Hannah's Legalized Kidnapping: A Rush to React Took Her Away for 207 Days (Paperback),"14,860원"
[외국도서],Read and React (Beginner - Intermediate) (Spiral Bound),"40,950원"
[외국도서],"When Big Issues Happen to Little Girls: How to Prepare, React, and Manage Your Emotions So You Can Best Support Your Daughter (Paperback)","17,160원"
[외국도서],Webs of Resistence in a Newly Privatized Polish Firm: Workers React to Organizational Transformation (Hardcover),"219,960원"
[외국도서],"The Horse Behavior Problem Solver: All Your Questions Answered about How Horses Think, Learn, and React (Paperback)","22,900원"
[외국도서],Programmare in React Native: La guida di programmazione siti internet e sviluppo web app per principianti (Paperback),"16,760원"
[외국도서],The React Workshop: Get started with building web applications using practical tips and examples from React use cases (Paperback),"45,900원"
[외국도서],React js: Modern web development using React js (Paperback),"14,900원"
[외국도서],React js: The Ultimate Beginner's Guide to Learn React js Programming Step by Step - 2020 (Paperback),"13,750원"
[외국도서],Beginning React Native with Hooks (Paperback),"17,200원"
[외국도서],"Respond, Don't React: Close Encounters of the Law Enforcement Kind (Paperback)","7,060원"
[외국도서],Sometimes It's Better To React With No Reaction: 50+ Unique Designs Motivation Coloring Book for Stress-Relief. With Inspiring quotes and Positive aff (Paperback),"8,010원"
[외국도서],Beginning React with Hooks (Paperback),"19,490원"
[외국도서],Developing a Mobile Application UI with Ionic and React: How to Build Your First Mobile Application with Common Web Technologies (Paperback),"22,940원"
[외국도서],"Learning to Respond, Not React: The Women's Guide to Understanding (Paperback)","8,010원"
[외국도서],"Building React Apps with Server-Side Rendering: Use React, Redux, and Next to Build Full Server-Side Rendering Applications (Paperback)","40,870원"
[외국도서],React: The Complete Beginner's Guide to React (Paperback),"16,050원"
[외국도서],"Modern Front-End Development for Rails: Webpacker, Stimulus, and React (Paperback)","52,750원"
[외국도서],Designing Applications with Spring Boot 2.2 and React JS: Step-by-step guide to design and develop intuitive full stack web applications (Paperback),"37,820원"
[외국도서],"How Do You React To Others Success?: A softcover blank lined notebook to jot down business ideas, take notes for class or ponder life's big questions. (Paperback)","8,010원"
[외국도서],"It's Not Necessary to React to Everything You Notice: Blank Lined Journal - Journals for Mindfulness, 6x9 Creative Thoughts Diary (Paperback)","8,010원"
[외국도서],Cats React to Science Facts (Paperback),"15,150원"
[외국도서],React: Up & Running: Building Web Applications (Paperback),"57,380원"
[외국도서],"It's not what happens to you, but how you react to it that matters.: 110 Lined Pages Motivational Notebook with Quote by Epictetus (Paperback)","6,870원"
[외국도서],Cats React to Science Facts (Hardcover),"19,700원"
[외국도서],React Explained: Your Step-By-Step Guide to React (Paperback),"29,790원"
[외국도서],"Measures of Success: React Less, Lead Better, Improve More (Paperback)","45,860원"
[외국도서],An Angel's Love: What Will Happen When Two Angels One Dark and One Light Fall in Love with the Same Human Female? How Will She React Wh (Paperback),"24,090원"
[외국도서],Durchstarten mit React (Paperback),"50,100원"
[외국도서],React Native (Paperback),"55,120원"
[외국도서],How Does the Stock Market React to Corporate Environmental News？ (Paperback),"74,620원"
[외국도서],"Modern JavaScript Web Development Cookbook : Easy solutions to common web development problems with coverage on React, Node.js, and Microservices (Paperback)","51,640원"
[외국도서],The Minimum JavaScript You Should Know When You Code React & Redux (Paperback),"34,320원"
[외국도서],React Router Quick Start Guide : Routing in React applications made easy (Paperback),"34,420원"
[외국도서],React Cookbook (Paperback),"51,640원"
[외국도서],React Native+Ex (B5),"51,730원"
[외국도서],Life Is 10% What Happens to Me and 90% How I React to It: An Inspirational Journal to Get You Motivated! (Paperback),"9,160원"
[외국도서],Beginning React (Paperback),"15,000원"
[외국도서],Zombie Apocalypse Guide: How to React When All Goes Wrong (Paperback),"13,470원"
[외국도서],Hands-On Full-Stack Development with Spring 5 and React : Build Modern and Scalable Full Stack applications (Paperback),"51,640원"
[외국도서],React Design Patterns and Best Practices (Paperback),"51,640원"
[외국도서],Beginning Ethereum and Solidity with React: Complete Guide to Becoming a Blockchain Developer (Paperback),"22,940원"
[외국도서],React、Angular、Vue.js、React Nativeを使って學ぶ はじめてのフロントエンド開發 (單行本(ソフトカバ-)),"30,400원"
[외국도서],"React进階之路 (平裝, 第1版)","39,330원"
[외국도서],"React 16 Tooling : Improve your development experience by leveraging cutting edge React tools like create-react-app, Jest, and Flow (Paperback)","51,640원"
[외국도서],"React快速上手開發 (平裝, 第1版)","27,930원"
[외국도서],React: Cross-Platform Application Development with React Native (Paperback),"45,900원"
[외국도서],"MERN全棧開發(使用Mongo Express React和Node)/Web開發經典叢书 (平裝, 第1版)","34,080원"
[외국도서],"React Native移動開發實戰 (平裝, 第1版)","39,330원"
[외국도서],La Practica del Mindfulzen.: Meditacion & Gestion de Emociones. Reset. Rearm. React (Paperback),"18,310원"
[외국도서],"React前端技術與工程實踐 (平裝, 第1版)","39,330원"
[외국도서],"PCB Currents: How They Flow, How They React (Paperback) (Paperback)","125,980원"
[외국도서],React and React Native (Paperback),"57,380원"
[외국도서],Progressive Web Apps with React (Paperback),"51,640원"
[외국도서],React Native - Building Mobile Apps with JavaScript (Paperback),"43,000원"
[외국도서],Fullstack React: The Complete Guide to Reactjs and Friends (Paperback),"68,860원"
[외국도서],"Learning React Native: Building Native Mobile Apps with JavaScript (Paperback, 2)","68,860원"
[외국도서],Reactビギナ-ズガイド ―コンポ-ネントベ-スのフロントエンド開發入門 (單行本(ソフトカバ-)),"33,330원"
[외국도서],React Native Tutorial: How to Start with React Native. Beginners Guide Book (Paperback),"12,890원"
[외국도서],Time to React: The Efficiency of International Organizations in Crisis Response (Paperback),"38,660원"
[외국도서],Mastering React (Paperback),"26,000원"
[외국도서],React Native for iOS Development (Paperback),"51,780원"
[외국도서],How Investment Banks React to a Decline in League Table Rankings. Evidence from U.S. Corporate Bonds (Paperback),"52,690원"
[외국도서],Webs of Resistence in a Newly Privatized Polish Firm : Workers React to Organizational Transformation (Paperback),"60,660원"
[외국도서],React and Rise Up (Paperback),"19,450원"
[외국도서],K12 PDF EBK CHEM CHEM REACT 8E,"311,680원"
[외국도서],AP TCHR GDE CHEM CHEM REACT (Paperback),"15,520원"
[외국도서],ORGANOMET REACT 03 (Hardcover),"104,670원"
[외국도서],入門 React ―コンポ-ネントベ-スのWebフロントエンド開發 (大型本),"34,660원"
[외국도서],The Must-React System: User's Guide to Prospecting C-Suite Executives (Paperback),"16,010원"
[외국도서],"Hot Button Motivation: Increase Sales, Improve Relationships, and Understand Why People Act and React! (Paperback)","22,900원"
[외국도서],"The Evolution of Revolutions: How We Create, Shape, and React to Change (Hardcover)","26,000원"
[외국도서],"Don't Blow the Interview: How to Prepare, What to Expect, and How to React (Paperback)","20,640원"
[외국도서],A/React (Paperback),"23,680원"
[외국도서],My Book Full of Feelings: How to Control and React to the Size of Your Emotions (Spiral),"34,440원"
[외국도서],Beginning React with Hooks (Paperback),"19,490원"
[외국도서],Cats React to Outer Space Facts (Paperback),"15,150원"
[외국도서],React Js Foundations Building User Interfaces with Reactjs: An Approachable Guide (Paperback),"52,500원"
[외국도서],Don't Over React!: An entertaining guide to help you succeed in college-level general chemistry First Semester (Paperback),"28,640원"
[외국도서],Crossing: How We Label and React to People on the Move (Hardcover),"107,100원"
[외국도서],React Deep Dive (Paperback),"32,140원"
[외국도서],Sometimes It's Better To React With No Reaction Motivational Adult Coloring Book: 50+ Unique Designs Motivation Coloring Book for Stress-Relief. With (Paperback),"8,010원"
[외국도서],React Hooks in Action : With Suspense and Concurrent Mode (Paperback),"48,520원"
[외국도서],Functional Architecture with React and Redux (Paperback),"18,350원"
[외국도서],"Full-Stack React Projects - Second Edition: Learn MERN stack development by building modern web apps using MongoDB, Express, React, and Node.js (Paperback)","40,160원"
[외국도서],Indomitable Spirit: How to React and Survive in a School Shooting (Paperback),"11,460원"
[외국도서],Functional React (Paperback),"17,160원"
[외국도서],React js: The Complete Beginner's Guide to React - 2nd Edition (2020) (Paperback),"18,350원"
[외국도서],"Life is 10% what happens to you and 90% how you react to it.: notebook with 120+ Pages of 6""x 9"" (Paperback)","8,010원"
[외국도서],"React Native Coding Journal: Lined Notebook / Journal Gift, 120 Pages, 6x9, Soft Cover, Matte Finish (Paperback)","8,590원"
[외국도서],React Projects (Paperback),"40,160원"
[외국도서],How You React: BLUE COVER ALL PURPOSES JOURNAL with Mahatma Kandhi's inspirational quote; Motivational Message from Dad Mom Teachers (Paperback),"8,010원"
[외국도서],How You React: OCEAN GREEN COVER MULTI - PURPOSES JOURNAL with Mahatma Kandhi's inspirational quote; Motivational Message from Dad Mo (Paperback),"8,010원"
[외국도서],How You React: ALL PURPOSES JOURNAL with inspirational quotes from Mahatma Kandhi in Black Cover; Motivational Message from Dad Mom T (Paperback),"8,010원"
[외국도서],The Friends and Foes of Jesus: Discover How People in the New Testament React to God's Good News (Hardcover),"24,090원"
[외국도서],Easy React JS for Beginner Developers: A step-by-step visual guide to learn React js and building your own React applications from scratch (Paperback),"22,940원"
[외국도서],"Cats React to Science Facts (Library Binding, Library)","26,380원"
[외국도서],DESARROLLO WEB CON REACT (Paperback),"40,490원"
[외국도서],The only thing you can really control is how you react to things out of your control.: Blank Lined Journal with Soft Matte Cover (Paperback),"8,010원"
[외국도서],Hands-On Full Stack Development with Spring Boot 2 and React - Second Edition (Paperback),"40,160원"
[외국도서],"OpenCV 4 for Secret Agents : Use OpenCV 4 in secret projects to classify cats, reveal the unseen, and react to rogue drivers, 2nd Edition (Paperback, 2 Revised edition)","45,900원"
[외국도서],"It's Not What Happens To You, But How You React To It That Matter.: Blank Lined Notebook Journal Diary Composition Notepad 120 Pages 6x9 Paperback ( M (Paperback)","8,010원"
[외국도서],"Measures of Success: React Less, Lead Better, Improve More (Hardcover)","68,820원"
[외국도서],React from Zero: Learn React Using the JavaScript You Already Know (Paperback),"21,810원"
[외국도서],The Road to React with Firebase: Your Journey to Master Advanced React for Business Web Applications (Paperback),"34,420원"
[외국도서],Taming the State in React: Your Journey to Master Redux and Mobx (Paperback),"34,420원"
[외국도서],"Never Judge Anyone as Most of Them Are Idiots, When Someone Judges You Don't React, as Most of Them Are Idiots: Weed Gifts Notebook / Journal (6''x9'' (Paperback)","8,010원"
[외국도서],"React 狀態管理與同構實戰 (平裝, 1st)","45,030원"
[외국도서],"React Native Cookbook(中文版) (平裝, 1st)","33,630원"
[외국도서],Network Attack Traceback And React (Paperback),"120,480원"
[외국도서],"React Native for Mobile Development: Harness the Power of React Native to Create Stunning IOS and Android Applications (Paperback, 2)","40,870원"
[외국도서],".Net Knowledge Book: Typescript, React and Redux (Paperback)","19,490원"
[외국도서],"Pro Mern Stack: Full Stack Web App Development with Mongo, Express, React, and Node (Paperback, 2)","47,690원"
[외국도서],Learning Web Development with React and Bootstrap (Paperback),"45,900원"
[외국도서],"Warning! Due to the Shortage of Robots, Some of Our Staff Are Human and May React Unpredictably When Rushed or Abused!: Snarky, Bitchy and Smartass No (Paperback)","9,160원"
[외국도서],"React Native精解與實戰 (平裝, 第1版)","45,030원"
[외국도서],React (Paperback),"14,950원"
[외국도서],How Different Ehtnic Groups React to Legal Authority (Hardcover),"13,300원"
[외국도서],"React Native全敎程:移動端跨平台應用開發 (平裝, 第1版)","45,030원"
[외국도서],Serverless Web Applications with React and Firebase (Paperback),"45,900원"
[외국도서],React: Guia Rapida Paso a Paso Para Aprender La Biblioteca React de JavaScript (Paperback),"15,350원"
[외국도서],It's Time to React: Reauthorizing Executive Authority to Consolidate Task: Establishing Results and Sunset Commissions (Paperback),"21,790원"
[외국도서],Beginning React (Paperback),"19,490원"
[외국도서],"Web開發經典叢书:React開發實戰 (平裝, 第1版)","33,060원"
[외국도서],"React與Redux開發實例精解 (平裝, 第1版)","33,630원"
[외국도서],Mastering Full Stack React Web Development (Paperback),"70,280원"
[외국도서],React Native by Example (Paperback),"51,640원"
[외국도서],"Screamfree Parenting, 10th Anniversary Revised Edition: How to Raise Amazing Adults by Learning to Pause More and React Less (Audio CD)","39,200원"
[외국도서],The Impact of 3D Printers in the Logistics Industry. How Could This Technology Change Logistics and How Should the Logistics Industry React to This Ad (Paperback),"33,860원"
[외국도서],Reactjs by Example- Building Modern Web Applications with React (Paperback),"29,000원"
[외국도서],The Must-React System: User's Guide to Prospecting C-Suite Executives (Hardcover),"27,490원"
[외국도서],Reach-React: Selected Paintings and Drawing 1980-2012 (Paperback),"37,820원"
[외국도서],Introduction to React (Paperback),"34,060원"
[외국도서],Indomitable Spirit: How to React and Survive in a School Shooting (Paperback),"11,460원"
[외국도서],"The Mule Behavior Problem Solver: How Mules Think, Learn and React (Paperback, 1)","56,680원"
