tag,title,price[외국도서],Y2K and Nuclear Power: Will the Reactors React Responsibly? (Paperback),"37,590원"
[외국도서],CHEM HUMAN ACT CHEM REACT EBK OWL,"93,380원"
[외국도서],TCH APGDE LIT RDG REACT WRT 3E (Paperback),"33,280원"
[외국도서],IAC COMP LIT READ REACT WTG 6E,"59,920원"
[외국도서],IM CHEMISTRY PRIN REACT 7E (Paperback),"48,260원"
[외국도서],K12 EBK CD CHEM CHEM REACT 7E,"301,690원"
[외국도서],IE CHEMISTRY PRIN REACT 7E (Hardcover),"216,450원"
[외국도서],"God Acts - We React (Paperback, 2ND)","13,300원"
[외국도서],"Hot Button Motivation: Increase Sales, Improve Relationships, and Understand Why People ACT and React!                                                 (Hardcover)","30,930원"
[외국도서],After the Diagnosis: How Patients React and How to Help Them Cope (Paperback),"99,810원"
[외국도서],My Child Is Gay: How Parents React When They Hear the News (Paperback),"22,900원"
[외국도서],The Imperial Presidency and the Consequences of 9/11 [2 Volumes]: Lawyers React to the Global War on Terrorism (Hardcover),"273,420원"
[외국도서],If the World Ended Today How Would You React to Saving the World or Helping the World or Would It All Be Over for You (Paperback),"22,940원"
[외국도서],React js: Learning React js Library From Scratch (Paperback),"17,200원"
[외국도서],Beginning React Native with Hooks (Paperback),"17,200원"
[외국도서],React Native: Guida completa allo sviluppo e programmazione di siti internet e web app con ReactJS. Contiene esempi di codice ed ese (Paperback),"16,940원"
[외국도서],WA IAC HMWRK K12AE CHEM/CHEM REACT ENHNCD ED,"29,020원"
[외국도서],Crossing: How We Label and React to People on the Move (Paperback),"28,700원"
[외국도서],React js: The Ultimate Beginner's Guide to Learn React js Programming Step by Step 2020 (Paperback),"18,350원"
[외국도서],Sometimes It's Better To React With No Reaction Inspirational Adult Coloring Book: 50+ Unique Designs Motivation Coloring Book for Stress-Relief. With (Paperback),"8,010원"
[외국도서],"Functional React, 2nd Edition: Quick start with React Hooks, Redux and MobX (Paperback)","18,350원"
[외국도서],React and React Native (Paperback),"40,160원"
[외국도서],"Full Stack Serverless: Modern Application Development with React, Aws, and Graphql (Paperback)","68,860원"
[외국도서],Advanced Web Development with React: SSR and PWA with Next.js using React with advanced concepts (English Edition) (Paperback),"28,640원"
[외국도서],"User Innovation in Healthcare: How Patients and Caregivers React Creatively to Illness (Paperback, 2020)","68,140원"
[외국도서],React programming: The Ultimate Beginner's Guide to Learn react js Programming Step by Step (Paperback),"19,490원"
[외국도서],Mastering React Native (Paperback),"51,640원"
[외국도서],"It's Not the Fact, It's How You React (Paperback)","12,610원"
[외국도서],React (Paperback),"58,480원"
[외국도서],React (Hardcover),"70,570원"
[외국도서],ALL people have adversity. What separates the good from the great is how we choose to react to it. Dot Grid Bullet Journal: A minimalistic dotted bull (Paperback),"9,160원"
[외국도서],"Be Disciplined About What You Respond And React To Not Everyone Deserves You Time, Energy And Attention.: Positive Inspirational Notebook and Positive (Paperback)","8,010원"
[외국도서],ASP.NET Core 3 and React (Paperback),"45,900원"
[외국도서],How You React: ROSE PINK COVER MULTI PURPOSES JOURNAL with inspirational quote from Mahatma Kandhi; 6x9 inches with 120 lined pages; (Paperback),"8,010원"
[외국도서],It's time to react: reauthorizing executive authority to consolidate task: establishing results and sunset commissions (Paperback),"16,050원"
[외국도서],Learn to Conquer React: A Step-By-Step Visual Guide to Learn React Js and Creating Your Own Modern React Applications (Paperback),"22,940원"
[외국도서],Life is 10% what happens to you and 90% how you react to it: Writing careers journals and notebook. A way towards enhancement (Paperback),"8,010원"
[외국도서],Life is 10% what happens to you and 90% how you react to it: Writing careers journals and notebook. A way towards enhancement (Paperback),"8,010원"
[외국도서],Cats React to Science Facts (Paperback),"11,460원"
[외국도서],"How Do You React To Others Success?: A softcover blank lined notebook to jot down business ideas, record daily events and ponder life's big questions. (Paperback)","8,010원"
[외국도서],"JavaScript+Vue+React全程實例 (平裝, 1st)","39,330원"
[외국도서],"It's Not What Happens To You But How You React To It That Matters: A soft cover blank lined journal to jot down ideas, memories, goals, and anything e (Paperback)","8,010원"
[외국도서],"Life Is How You React To It: A soft cover blank lined journal to jot down ideas, memories, goals, and anything else that comes to mind. (Paperback)","8,010원"
[외국도서],"Maturity Doesn't Mean Age. It Means Sensitivity, Manners And How You React: Daily Success, Motivation and Everyday Inspiration For Your Best Year Ever (Paperback)","8,010원"
[외국도서],Life Is 10% What Happens To You & 90% How You React To It: Inspirational and Motivational Lined Notebook Journal (Paperback),"8,010원"
[외국도서],React Material-UI Cookbook : Build captivating user experiences using React and Material-UI (Paperback),"45,900원"
[외국도서],"React Design Patterns and Best Practices : Design, build and deploy production-ready web applications using standard industry practices, 2nd Edition (Paperback, 2 Revised edition)","35,000원"
[외국도서],Create React App 2.0 Quick Start Guide (Paperback),"37,780원"
[외국도서],"Cloud Native Go-構建基于Go和React的云原生Web應用與微服務 (平裝, 1st)","39,330원"
[외국도서],"React Native Cookbook : Step-by-step recipes for solving common React Native development problems, 2nd Edition (Paperback, 2 Revised edition)","45,900원"
[외국도서],Hands-On Full-Stack Web Development with GraphQL and React : Build scalable full-stack applications while learning to solve complex problems with Grap (Paperback),"49,000원"
[외국도서],Do German Capital Markets React When Corporate Insiders Exercise Stock Options？ (Paperback),"18,250원"
[외국도서],Bi2Sr2CaCu2O8+x React Wind Sinter Experiments (Paperback),"75,760원"
[외국도서],"Test-Driven React: Find Problems Early, Fix Them Quickly, Code with Confidence (Paperback)","52,750원"
[외국도서],"Passing of Time: How Will Vonny React When She Learns, Her Mum, Is Her Girlfriend Fern's Mum's Lesbian Lover from the Past? (Paperback)","8,430원"
[외국도서],"Hands-On Full-Stack Web Development with ASP.NET Core : Learn end-to-end web development with leading frontend frameworks, such as Angular, React, and (Paperback)","51,640원"
[외국도서],"Node.Js, Mongodb, React, React Native Full-Stack Fundamentals and Beyond (Paperback)","19,510원"
[외국도서],Hands-On Design Patterns with React Native : Proven techniques and patterns for efficient native mobile development with JavaScript (Paperback),"45,900원"
[외국도서],"React and  React Native : Complete guide to web and native mobile development with React, 2nd Edition (Paperback, 2 Revised edition)","54,000원"
[외국도서],"It's Not Necessary to React to Everything You Notice: Blank Lined Journal - Journals for Mindfulness, 6x9 Creative Thoughts Diary (Paperback)","8,010원"
[외국도서],"Full-Stack React Projects : Modern web development using React 16, Node, Express, and MongoDB (Paperback)","51,640원"
[외국도서],"React Native企業實戰(前端開發工程師系列) (平裝, 第1版)","17,100원"
[외국도서],Getting Started with React VR (Paperback),"51,640원"
[외국도서],"React全棧:Redux+Flux+webpack+Babel整合開發 (平裝, 第1版)","39,330원"
[외국도서],"React Native移動開發實戰 (平裝, 第1版)","39,330원"
[외국도서],作りながら學ぶ React入門 (單行本),"26,660원"
[외국도서],"React: QuickStart Step-By-Step Guide to Learning React JavaScript Library (React.Js, Reactjs, Learning React Js, React JavaSc (Paperback)","18,800원"
[외국도서],My Child Is Gay: How Parents React When They Hear the News (Paperback),"22,330원"
[외국도서],いまどきのJSプログラマ-のための Node.jsとReactアプリケ-ション開發テクニック (單行本),"45,320원"
[외국도서],Think React Lead: When Success and Accomplishments Aren't Enough (Paperback),"17,160원"
[외국도서],What Kind of Provisions Regulate the Access to Arv Medicine and How Did Thailand React? (Paperback),"18,940원"
[외국도서],Isomorphic Web Applications: Universal Development with React (Paperback),"50,380원"
[외국도서],How I Respond: A Workbook to Track and Change How You Respond to Things to Which You Often React (Paperback),"11,460원"
[외국도서],Getting Started with React (Paperback),"40,160원"
[외국도서],Indomitable Spirit: How to React and Survive in a School Shooting (Hardcover),"34,420원"
[외국도서],"React Quickly: Painless Web Apps with React, Jsx, Redux, and Graphql (Paperback)","57,380원"
[외국도서],React to the Past: Confuc& Trial& India& Ana Pk (Paperback),"85,250원"
[외국도서],"He Really Loves Me! Love, Boundaries and Healing by Changing how we Think & React (Paperback)","13,710원"
[외국도서],Think More--React Less: You've Been Told You Should. No One Has Shown You How...Until Now. (Hardcover),"40,120원"
[외국도서],Think More--React Less: You've Been Told You Should. No One Has Shown You How...Until Now. (Paperback),"14,860원"
[외국도서],IAC LIT RDG REACT WRTG 6E,"41,940원"
[외국도서],EC EVOLRADIOLOG SITNUCLEAR REACT,"157,330원"
[외국도서],MM MGR CD CHEM CHEM REACT 7E,"2,757,240원"
[외국도서],Network Security Traceback Attack and React in the United States Department of Defense Network (Hardcover),"86,100원"
[외국도서],ReAct(リアクト) (單行本(ソフトカバ-)),"15,990원"
[외국도서],"Gurdjieff, a Beginner's Guide--How Changing the Way We React to Misplacing Our Keys Can Transform Our Lives (Paperback)","22,960원"
[외국도서],Time to React: The Efficiency of International Organizations in Crisis Response (Hardcover),"98,600원"
[외국도서],Think Before You React (Paperback),"27,550원"
[외국도서],"The Think, Read, React Plan for Writing (Paperback, 6)","196,490원"
[외국도서],"React Interact (Paperback, 3, Revised)","49,970원"
[외국도서],"Screamfree Parenting, 10th Anniversary Revised Edition: How to Raise Amazing Adults by Learning to Pause More and React Less (Paperback)","16,800원"
[국내도서],행동하는 세대,"6,300원"
[국내도서],리액트 웹앱 제작 총론 2/e,"27,000원"
[eBook],실전 리액트 프로그래밍,"25,000원"
[국내도서],처음 시작하는 리액트,"18,000원"
[eBook],리액트 교과서,"28,800원"
[국내도서],리액트 디자인 패턴과 모범 사례,"27,000원"
[eBook],러닝 리액트,"22,400원"
[국내도서],동형 자바스크립트 웹 개발,"22,500원"
[국내도서],시작하세요! 리액트 프로그래밍,"19,800원"
[국내도서],실무 예제로 배우는 ReactJS 완전정복,"22,500원"
[국내도서],리액트 정복하기,"22,500원"
[eBook],실전 리액트,"10,000원"
[외국도서],Great Minds Think Alike (Paperback),"11,480원"
[외국도서],An Experimental research on Consumer Behavior; using Service and Product (Paperback),"80,360원"
[외국도서],The Role of Organization-public Relationships in Crisis Communication (Paperback),"63,140원"
[외국도서],"GASP/GSVP-Militardoktrin (Paperback, German)","91,800원"
[외국도서],"My - 26 - ABC's 3 - In - 1 Series: Plus Animals, Fruit, Veggies and Desserts... (Paperback)","45,900원"
[외국도서],"No te ahogues en un vaso de agua / Don't Sweat the Small Stuff...and It's All Small Stuff (Paperback, Translation)","13,710원"
[외국도서],Kids Coping With War (Paperback),"7,970원"
[외국도서],Decisive Leadership by Tacit Knowledge (Paperback),"66,580원"
[외국도서],Decisive Leadership by Tacit Knowledge (Paperback),"73,470원"
[외국도서],"Portable Literature: Reading, Reacting, Writing (Paperback, 9th)","39,000원"
[음반],[수입] Real Ibiza V,"36,700원"
[국내도서],React.js 핵심정리,"18,000원"
[외국도서],"Take responsibility for your actions and inactions, realizing that at all times, you get to choose how to act or react. Journal: A minimalistic Lined (Paperback)","9,160원"
[외국도서],Don't Learn How to React. Learn How to Respond: Lgbt Diary & Mood Notebook - Grey (Paperback),"8,010원"
[외국도서],Learn React.Js by Building Games: 2nd Edition (Paperback),"43,620원"
[외국도서],React.Js in a Day (Paperback),"11,460원"
[외국도서],React.js Essentials (Paperback),"25,000원"
[외국도서],The Road to Graphql: Your Journey to Master Pragmatic Graphql in JavaScript with React.Js and Node.Js (Paperback),"34,420원"
[외국도서],Don't Learn How to React. Learn How to Respond: Lgbt Diary & Mood Notebook in Grey (Paperback),"8,010원"
[외국도서],Don't Learn How to React. Learn How to Respond: Lgbt Diary & Mood Notebook - Black (Paperback),"8,010원"
[외국도서],Learn React.Js by Building Games: Covering Fundamental and Advanced Concepts of React.Js (Paperback),"43,620원"
[외국도서],"Take responsibility for your actions and inactions, realizing that at all times, you get to choose how to act or react. Dot Grid Bullet Journal: A min (Paperback)","9,160원"
[외국도서],React.JS Question Bank (Paperback),"13,770원"
[외국도서],Don't Learn How to React. Learn How to Respond: Lgbt Diary & Mood Notebook in Black (Paperback),"8,010원"
[외국도서],React.js Complete Guide To Server-Side Rendering (Paperback),"14,900원"
[외국도서],"""IT'S NOT WHAT HAPPENS THAT COUNTS ... IT'S HOW YOU REACT.""Bruce Lee Journal: 6x9 Inch 100 pages Journal/Notebook: Inspiring quote by Bruce Lee: Energ (Paperback)","8,010원"
[외국도서],"""IT'S NOT WHAT HAPPENS THAT COUNTS ... IT'S HOW YOU REACT.""Bruce Lee Journal: 6x9 Inch 100 pages Journal/Notebook: Inspiring quote by Bruce Lee - Ener (Paperback)","8,010원"
[외국도서],"React.js實戰 (平裝, 1st)","33,630원"
[외국도서],React.js&Next.j,"39,990원"
[외국도서],Life Is 10% What Happens to Me and 90% How I React. -John Maxwell: Optimizedself Journal Diary Notebook for Beautiful Women (Paperback),"9,160원"
[외국도서],React.Js Jump Start (Paperback),"10,310원"
[외국도서],React.Js Succinctly (Paperback),"10,310원"
[외국도서],Building React.Js Applications with Redux (Paperback),"45,900원"
[외국도서],"Turbulent Reacting Flows (Paperback, Softcover Repri)","115,850원"
[외국도서],2020 Presidential Debate: How The World's Media Reacted (Paperback),"13,750원"
[외국도서],"Trump Tweets, the World Reacts: Understanding What Is Relevant and Why (Paperback)","50,380원"
[외국도서],"Food Fight: Challenging the USDA Food Pyramid, 1991 (Paperback)","22,960원"
[외국도서],Rethinking Globally and Reacting Locally - Together We Achieve (Paperback),"74,620원"
[외국도서],"Europe on the Brink, 1914: The July Crisis (Paperback)","34,440원"
[외국도서],"Fear Reacts, Love Responds: Record your thoughts and dreams (Paperback)","8,910원"
[외국도서],Triggers: How We Can Stop Reacting and Start Healing (Paperback),"18,980원"
[외국도서],I Can't Help How My Face Reacts When You Speak: Notebook - 9 X 6 with Lined Paper (Paperback),"8,010원"
[외국도서],"LES of the Pulsating, Non-Reacting Flow in Combustion Chambers (Paperback)","81,500원"
[외국도서],Phenomenology of Non-Reacting Spray (Paperback),"83,610원"
[외국도서],"Playing to Learn with Reacting to the Past: Research on High Impact, Active Learning Practices (Paperback)","34,060원"
[외국도서],Effect of Jet Injection Angle and Number of Jets on Mixing and Emissions from a Reacting Crossflow at Atmospheric Pressure (Paperback),"13,750원"
[외국도서],An Explicit Runge-Kutta Method for Turbulent Reacting Flow Calculations (Paperback),"26,380원"
[외국도서],Instantaneous Velocity Field Imaging Instrument for Supersonic Reacting Flows (Paperback),"34,420원"
[외국도서],"Les, DNS and Rans for the Analysis of High-Speed Turbulent Reacting Flows (Paperback)","34,420원"
[외국도서],Instrumentation Development for Study of Reynolds Analogy in Reacting Flows (Paperback),"20,640원"
[외국도서],Development of a 3-D Upwind Pns Code for Chemically Reacting Hypersonic Flowfields (Paperback),"20,640원"
[외국도서],Numerical Prediction of Non-Reacting and Reacting Flow in a Model Gas Turbine Combustor (Paperback),"22,940원"
[외국도서],A Novel Strategy for Numerical Simulation of High-Speed Turbulent Reacting Flows (Paperback),"22,940원"
[외국도서],Improving TCP Network Performance by Detecting and Reacting to Packet Reordering (Paperback),"22,940원"
[외국도서],Effect of Jet Injection Angle and Number of Jets on Mixing and Emissions from a Reacting Crossflow at Atmospheric Pressure (Paperback),"22,940원"
[외국도서],"Compact Literature + Mindtap Literature 2.0, 1-term, 6 Months Printed Access Card (Paperback, Pass Code, 9th)","125,930원"
[외국도서],Speed Boxing Secrets: A 21-Day Program to Hitting Faster and Reacting Quicker in Boxing and Martial Arts (Paperback),"14,900원"
[외국도서],"Compact Literature + Mindtap Literature, 1 Term 6 Months Access Card (Paperback, 9th, PCK)","125,930원"
[외국도서],Theory and Modeling of Dispersed Multiphase Turbulent Reacting Flows (Paperback),"143,500원"
[외국도서],"Portable Literature: Reading, Reacting, Writing (with 2016 MLA Update Card) (Paperback, 9)","125,930원"
[외국도서],Microhardness and Strain Field Characterization of Self-Reacting Friction Stir and Plug Welds of Dissimilar Aluminum Alloys (Paperback),"61,740원"
[외국도서],"Stop Reacting and Start Responding (Paperback, Revised)","22,610원"
[외국도서],Innovation Versus Adaptability: Seizing the Initiative Through Creative Thinking Versus Reacting to the Enemy (Paperback),"19,490원"
[외국도서],Innovation Thinking: Design Your Business for Competitive Advantage Rather Than Reacting to Your Competitor's Innovations (Paperback),"21,770원"
[외국도서],"Compact Literature: Reading, Reacting, Writing, 9th (Paperback, 9)","125,930원"
[외국도서],"Experimental Thermodynamics Volume II: Experimental Thermodynamics of Non-Reacting Fluids (Paperback, Softcover Repri)","177,200원"
[외국도서],"On the Thermodynamics of Elastic Materials and of Reacting Fluid Mixtures: Course Held at the Department of Mechanics of Solids, June 1971 (Paperback, 1971)","118,580원"
[외국도서],Reacting Flows in Porous Media (Paperback),"147,630원"
[외국도서],"Reacting to Reality Television : Performance, Audience and Value (Hardcover)","144,110원"
[외국도서],Romantic Drama : Acting and Reacting (Paperback),"56,110원"
[외국도서],Direct Numerical Simulation for Turbulent Reacting Flows (Paperback),"126,280원"
[외국도서],War (Hardcover),"16,010원"
[외국도서],Emergency Response to Domestic Terrorism : How Bureaucracies Reacted to the 1995 Oklahoma City Bombing (Hardcover),"151,700원"
[외국도서],"Introduction To Turbulent Reacting Flows, An (Paperback)","54,610원"
[외국도서],"Introduction To Turbulent Reacting Flows, An (Hardcover)","104,670원"
[외국도서],"Joe Biden's Victory: Barack Obama and others Reacts to Joe Biden and Kamala Harris' ""Weighty"" Win over Donald Trump (Paperback)","17,220원"
[외국도서],Reacting Multi-Species Gas Capability for USM3D Flow Solver (Paperback),"40,160원"
[외국도서],Effects of Fusion Tack Welds on Self-Reacting Friction Stir Welds (Paperback),"40,160원"
[외국도서],So What Really Effects Us Is Not What Happened But How We Reacted to It: Motivational Quote Notebook/Journal For 120 Pages of 6'x9' Lined (Paperback),"8,010원"
[외국도서],"Fear Reacts, Love Responds: Record your thoughts and dreams (Paperback)","8,910원"
[외국도서],Effect of Jet Injection Angle and Number of Jets on Mixing and Emissions From a Reacting Crossflow at Atmospheric Pressure (Paperback),"13,750원"
[외국도서],Setting The PACE: Stop Reacting to Life And Start Living It (Paperback),"11,460원"
[외국도서],Towards a Numerical Simulation of Supersonic Mixing & Combustion (Paperback),"106,760원"
[외국도서],Instrumentation Development for Study of Reynolds Analogy in Reacting Flows (Paperback),"21,790원"
[외국도서],Large Eddy Simulations and Direct Numerical Simulations of High Speed Turbulent Reacting Flows (Paperback),"21,790원"
[외국도서],Low-Frequency Sound Propagation Modeling Over a Locally-Reacting Boundary Using the Parabolic Approximation (Paperback),"21,790원"
[외국도서],"Using Neural Networks and Dyna Algorithm for Integrated Planning, Reacting and Learning in Systems (Paperback)","28,680원"
[외국도서],Computer Program to Solve Two-Dimensional Shock-Wave Interference Problems with an Equilibrium Chemically Reacting Air Model (Paperback),"34,420원"
[외국도서],Investigation of Supersonic Chemically Reacting and Radiating Channel Flow (Paperback),"34,420원"
[외국도서],A PDF Closure Model for Compressible Turbulent Chemically Reacting Flows (Paperback),"34,420원"
[외국도서],Large Eddy Simulations and Direct Numerical Simulations of High Speed Turbulent Reacting Flows (Paperback),"20,640원"
[외국도서],Low-Frequency Sound Propagation Modeling Over a Locally-Reacting Boundary Using the Parabolic Approximation (Paperback),"20,640원"
[외국도서],Convection of a Pattern of Vorticity Through a Reacting Shock Wave (Paperback),"20,640원"
[외국도서],Numerical Simulation of High-Speed Turbulent Reacting Flows (Paperback),"45,900원"
[외국도서],Reacting Multi-Species Gas Capability for Usm3d Flow Solver (Paperback),"28,680원"
[외국도서],"Trump Tweets, the World Reacts: Understanding What Is Relevant and Why (Hardcover)","109,060원"
[외국도서],"Chemically Reacting Flow: Theory, Modeling, and Simulation (Hardcover, 2)","232,750원"
[외국도서],"Compact Literature + Questia, 1 Term 6 Months Printed Access Card (Paperback, 9th, PCK)","94,430원"
[외국도서],Field Theory in Child and Adolescent Psychoanalysis : Understanding and Reacting to Unexpected Developments (Hardcover),"182,040원"
[외국도서],"Compact Literature: Reading, Reacting, Writing, 2016 MLA Update (Paperback, 9)","114,740원"
[외국도서],Recent Advancements in Fully Implicit Numerical Methods for Hypersonic Reacting Flows: With Application to Reentry and Arcjet Modeling (Paperback),"20,370원"
[외국도서],Self-Reacting Friction Stir Welding for Aluminum Complex Curvature Applications (Paperback),"18,080원"
[외국도서],"Literature + Questia, 6-month Access (Hardcover, 8th, PCK)","125,930원"
[외국도서],Reacting Multi-Species Gas Capability for Usm3d Flow Solver (Paperback),"21,520원"
[외국도서],Determining Active Oxidant Species Reacting with Organophosphate Pesticides in Chlorinated Drinking Water (Paperback),"21,520원"
[외국도서],IM LIT READING REACTING WRT 7E (Paperback),"33,280원"
[외국도서],Computational Models for Turbulent Reacting Flows (Hardcover),"177,690원"
[외국도서],LITERATURE READING REACTING WRITING COMP (Paperback),"93,170원"
[외국도서],LITERATURE READING REACTING WRITING PORT (Paperback),"44,930원"
[외국도서],Reacting Flows (Hardcover),"194,040원"
[외국도서],Reacting Flows (Hardcover),"109,620원"
[외국도서],Reacting to Literature (Paperback),"9,290원"
[외국도서],"Literature: Reading, Reacting, Writing (Hardcover, 8)","125,930원"
[외국도서],NL to Do (Paperback),"51,660원"
[외국도서],Stochastic Dynamics of Reacting Biomolecules (Hardcover),"185,970원"
[외국도서],How the World's News Media Reacted to 9/11 (Hardcover),"80,300원"
[외국도서],How to Really Parent Your Child: Anticipating What a Child Needs Instead of Reacting to What a Child Does (Paperback),"17,200원"
[외국도서],Chemically Reacting Flow (Hardcover),"231,890원"
[외국도서],"Literature (Paperback, 7th, Compact)","215,760원"
[외국도서],Acting and Reacting: Tools for the Modern Actor (Paperback),"53,070원"
[외국도서],Modeling and Simulation of Reacting Systems and Environment (Paperback),"159,030원"
[외국도서],The Pre-Flop Game in Online Poker - A Quantitive Analysis (Paperback),"60,150원"
[외국도서],The strange case of inequality in Slovakia and the Czech Republic (Paperback),"66,860원"
[eBook],Dying cells expose a nuclear antigen cross-reacting with anti-PD-1 monoclonal antibodies,"1,000원"
[외국도서],"Using Neural Networks and Dyna Algorithm for Integrated Planning, Reacting and Learning in Systems (Paperback)","21,790원"
[외국도서],Computational Reacting Gas Dynamics (Paperback),"34,420원"
[외국도서],"A Two-Dimensional Numerical Simulation of a Supersonic, Chemically Reacting Mixing Layer (Paperback)","34,420원"
[외국도서],"Direct Simulations of Chemically Reacting Turbulent Mixing Layers, Part 2 (Paperback)","28,680원"
[외국도서],Experimental Reacting Hydrogen Shear Layer Data at High Subsonic Mach Number (Paperback),"28,680원"
