tag,title,price[외국도서],Investigation of the Aerothermodynamics of Hypervelocity Reacting Flows in the RAM Accelerator (Paperback),"28,680원"
[외국도서],Domain Decomposition Methods for the Parallel Computation of Reacting Flows (Paperback),"20,640원"
[외국도서],"Bridging Scales in Modelling and Simulation of Non-Reacting and Reacting Flows. Part I, Volume 52 (Hardcover)","281,260원"
[외국도서],Calm Mind Happy Heart: Stop Reacting... & Start Creating the Life of Your Dreams - A Workbook (Paperback),"14,860원"
[외국도서],"Playing to Learn with Reacting to the Past: Research on High Impact, Active Learning Practices (Hardcover, 2018)","122,670원"
[외국도서],A Reasoned Response: Reacting to Reasons to Vote for Democrats: A Comprehensive Guide (Paperback),"8,010원"
[외국도서],Field Theory in Child and Adolescent Psychoanalysis : Understanding and Reacting to Unexpected Developments (Paperback),"48,520원"
[외국도서],"Literature: Reading, Reacting, Writing, Portable Edition (with Lit21 CD-ROM) (Paperback, 5th)","55,930원"
[외국도서],"Literature: Reading Reacting Writing (Hardcover, 2nd)","41,980원"
[외국도서],Proceedings Of The ASME Summer Heat Transfer Conference 2008 (Paperback),"264,040원"
[외국도서],"Literature: Reading, Reacting, Writing (AP Edition) (Hardcover, 8)","134,750원"
[외국도서],Radiation Effects on Unsteady Flow of a Chemically Reacting Fluid (Paperback),"45,920원"
[외국도서],Reacting Flows (Hardcover),"109,620원"
[외국도서],"Literature: Reading, Reacting, Writing (Hardcover, 4th)","133,490원"
[외국도서],When the Referees Reacted (Paperback),"6,830원"
[외국도서],"Literature: Reading, Reacting, Writing Lit21 Plus Cd-rom (CD-ROM, 5th)","95,690원"
[외국도서],Non-Equilibrium Reacting Gas Flows: Kinetic Theory of Transport and Relaxation Processes (Paperback),"156,750원"
[외국도서],"Literature: Reading, Reacting, Writing (Paperback, 5th)","39,000원"
[외국도서],"Computational Fluid Dynamics and Reacting Gas Flows (Paperback, Softcover Repri)","143,120원"
[외국도서],Fight Your Way to a Better Marriage (Hardcover),"25,230원"
[외국도서],Dynamics of Heterogeneous Combustion and Reacting Systems V-152 (Hardcover),"143,440원"
[외국도서],The World Reacts to the Holocaust (Hardcover),"119,390원"
[외국도서],Literature (Paperback),"10,000원"
[외국도서],Emergency Response to Domestic Terrorism : How Bureaucracies Reacted to the 1995 Oklahoma City Bombing (Paperback),"30,320원"
[외국도서],"Computational Gas-Solids Flows and Reacting Systems: Theory, Methods and Practice (Hardcover)","206,640원"
[외국도서],Non-Equilibrium Reacting Gas Flows: Kinetic Theory of Transport and Relaxation Processes (Hardcover),"218,100원"
[외국도서],"Literature (Hardcover, 7th)","255,940원"
[외국도서],Romantic Drama : Acting and Reacting (Hardcover),"116,800원"
[외국도서],"War (Paperback, 1st)","7,970원"
[외국도서],Acting and Reacting: Tools for the Modern Actor (Hardcover),"106,190원"
[외국도서],"Compact Literature (Paperback, 6th)","39,000원"
[외국도서],Faster Reacting Toys (Paperback),"17,200원"
[외국도서],Setting The PACE: Stop Reacting to Life And Start Living It (Paperback),"14,900원"
[외국도서],Reacting In Anger Or Annoyance Will Not Advance One's Ability To Persuade: Keep Calm Quote Notebook Gift Journal For For Women/Men & Boys/Girls (Paperback),"8,580원"
[외국도서],"Restoring the World, 1945: Security and Empire at Yalta (Paperback)","34,440원"
[외국도서],Your Bones Under the Microscope (Paperback),"113,940원"
[외국도서],"Henry VIII and the Reformation Parliament (Paperback, 2)","34,440원"
[외국도서],A Transport Equation for the Scalar Dissipation in Reacting Flows with Variable Density: First Results (Paperback),"26,380원"
[외국도서],Large Eddy Simulation and Direct Numerical Simulation of High Speed Turbulent Reacting Flows (Paperback),"40,160원"
[외국도서],A Method to Determine the Acoustical Properties of Locally and Nonlocally Reacting Duct Liners in Grazing Flow (Paperback),"26,380원"
[외국도서],"Les, Dns, and Rans for the Analysis of High-Speed Turbulent Reacting Flows (Paperback)","28,680원"
[외국도서],"Bridging Scales in Modelling and Simulation of Non-Reacting and Reacting Flows. Part II, Volume 53 (Hardcover)","281,260원"
[외국도서],Chain Reaction: Reacting to He Who Sets Us Free (Paperback),"11,320원"
[외국도서],"Stop Reacting and Start Responding: 108 Ways to Transform Behavior Into Learning Moments (Paperback, Revised with Ne)","20,600원"
[외국도서],"Portable Literature + Mindtap Literature, 1-term Access (Paperback, Pass Code, 9th)","125,930원"
[외국도서],Viscous Hypersonic Flow: Theory of Reacting and Hypersonic Boundary Layers (Paperback),"28,640원"
[외국도서],"Compact Literature: Reading, Reacting, Writing (with 2016 MLA Update Card) (Paperback, 9)","125,930원"
[외국도서],"Assessing Jet-Induced Spatial Mixing in a Rich, Reacting Crossflow (Paperback)","18,080원"
[외국도서],2xxx Aluminum Self Reacting Friction Stir Weld Development (Paperback),"16,930원"
[외국도서],Reacting Past India& South Africa Pkg (Paperback),"47,200원"
[외국도서],God's Goodness & Our Mindfulness: Responding Versus Reacting to Life Changing Circumstances (Paperback),"12,570원"
[외국도서],IM LIT READING REACTING WRT 8E (Paperback),"33,280원"
[외국도서],"Literature : Reading, Reacting, Writing (Paperback, 5 Rev ed)","51,590원"
[외국도서],Empathy and Social Categorization: Reacting to Persons in Need (Paperback),"80,360원"
[외국도서],"Bundle: Portable Literature: Reading, Reacting, Writing + InSite(TM) 1-Semester Printed Access Card + Personal Tutor feature NetTutor Printed Access C (CD-ROM, 8th)","166,530원"
[외국도서],"Reacting to the Past Game Designer's Handbook (Paperback, 3rd)","10,330원"
[외국도서],"Nonlinear Differential Equations of Chemically Reacting Systems (Paperback, Softcover Repri)","88,590원"
[외국도서],"Mathematical Aspects of Reacting and Diffusing Systems (Paperback, Softcover Repri)","109,040원"
[외국도서],"Reacting to Reality Television : Performance, Audience and Value (Paperback)","53,070원"
[외국도서],"Literature: Reading, Reacting, Writing: Instructors' Resource Manual to Accompany (Paperback, 5)","54,110원"
[외국도서],Reacting (Paperback),"36,670원"
[외국도서],Reacting to the Spending Spree: Policy Changes We Can Afford (Paperback),"16,800원"
[외국도서],Multiphase Reacting Flows: Modelling and Simulation (Paperback),"177,200원"
[외국도서],Acting and Reacting : Tools for the Modern Actor (Paperback),"19,700원"
[외국도서],Computational Models for Turbulent Reacting Flows (Paperback),"128,920원"
[음반],[수입] Material - Reacted [180g LP][2018 레코드 스토어 데이 500장 한정반],"32,900원"
[음반],[수입] WagakkiBand (화악기밴드) - React (CD+Live Documentary Book) (초회한정반)(CD),"40,800원"
[외국도서],"React, Interact (Paperback)","35,280원"
[eBook],RxJS 프로그래밍,"25,600원"
[국내도서],Vue.js 첫걸음,"19,800원"
[국내도서],머릿속으로 그리는 리액트 프로그래밍,"23,400원"
[국내도서],ReactJS 이 정도는 알아야지,"19,800원"
[국내도서],모던 자바스크립트 개발자를 위한 리액트 프로그래밍,"25,200원"
[외국도서],"Generation React (Paperback, 1st)","12,570원"
[외국도서],"Articles on Songs Written by Tim James (Music Producer), Including: I'll Be Your Everything, Another Dumb Blonde, Chemicals React, Come Back to Me (Va (Paperback)","20,370원"
[외국도서],"Harbrace Essentials + Portable Literature With 2016 Mla Update Card, 9th Ed. (Paperback, 9th, Updated)","125,930원"
[국내도서],빠른 모바일 앱 개발을 위한 React Native 리액트 네이티브,"22,500원"
[외국도서],"Compact Literature + Lms Integrated for Mindtap English Access Card (Paperback, 9th, PCK)","233,030원"
[외국도서],"Portable Literature + Lms Integrated for Mindtap English, 1 Term 6 Months Access Card (Paperback, 9th, PCK)","153,650원"
[외국도서],"Compact Literature + Mindtap Literature Access Card (Paperback, 9th, PCK)","233,030원"
[외국도서],"Compact Literature + 2016 Mla Update Card + Lms Integrated Mindtap English, 1 Term 6 Months Access Card (Paperback, 9th, PCK)","125,930원"
[외국도서],React (Paperback),"23,870원"
[외국도서],Poetry (Paperback),"73,010원"
[외국도서],Reputation Risk Management (Hardcover),"103,950원"
[외국도서],Learning React Native: Building Native Mobile Apps with JavaScript (Paperback),"45,900원"
[외국도서],"Literature: Reading, Reacting, Writing (Hardcover, 5)","133,490원"
[외국도서],"Portable Literature: Reading, Reacting, Writing (Paperback, 9)","114,740원"
[외국도서],The Horse Behavior Problem-Solver (Hardcover),"34,380원"
[외국도서],React (Hardcover),"28,640원"
[외국도서],"Compact Literature: Reading, Reacting, Writing (Paperback, 8)","125,930원"
[외국도서],The Power to Believe... (Hardcover),"22,900원"
[외국도서],Creating Growth from Change (Paperback),"22,060원"
[외국도서],"Portable Literature (Paperback, 7th)","136,550원"
[외국도서],"Literature (Hardcover, 7th)","220,430원"
[외국도서],"Portable Literature (Paperback, 6th)","30,000원"
[음반],[수입] Jason Robert Brown - How We React And How We Recover,"36,100원"
[국내도서],실전 리액트 프로그래밍,"28,800원"
[eBook],ReactJS 이 정도는 알아야지 : CodePen으로 바로바로 배우는 ReactJS,"17,600원"
[외국도서],React (Paperback),"55,120원"
[국내도서],리액트 네이티브 앱 제작 원론,"31,500원"
[외국도서],Learn React Fast: Over 250 Pages of Technical Information and Examples (Paperback),"22,940원"
[외국도서],"Portable Literature + Harbrace Essentials, 2nd Ed. (Paperback, 9th, PCK, Spiral)","193,970원"
[외국도서],Supporting Positive Behavior in Children and Teens with Down Syndrome: The Respond But Don't React Method (Paperback),"25,190원"
[외국도서],"Read, Write, React: An Integrated Approach to Reading and Writing (Paperback)","67,090원"
[외국도서],"Literature (Hardcover, PCK)","104,510원"
[외국도서],"Literature (Hardcover, 3rd)","79,310원"
[외국도서],"React Interact (Paperback, 2nd)","34,770원"
[외국도서],ACT or React: The Decision Is Ours (Hardcover),"26,380원"
[외국도서],EPIN OWL CHEM CHEM REACT 7E,"109,870원"
[외국도서],TIMESAVER READ REACT CORNELSEN,"34,120원"
[외국도서],"Literature : Reading, Reacting, Writing (Package, 5 Rev ed)","127,190원"
[외국도서],"Literature (Hardcover, 3rd)","104,510원"
[외국도서],How to React When a Racist Calls You the N-word (Paperback),"6,870원"
[외국도서],"Act/React (Paperback, DVD)","39,030원"
[외국도서],"Portable Literature (Paperback, 7th)","103,250원"
[외국도서],"Literature (Paperback, 6th, Compact)","180,110원"
[음반],[수입] Material - Reacted (LP),"33,700원"
[음반],[수입] WagakkiBand (화악기밴드) - React (CD+DVD) (초회한정영상반),"46,200원"
[음반],[수입] WagakkiBand (화악기밴드) - React (CD),"28,600원"
[외국도서],Your Full Future After the Empty Nest (Paperback),"11,420원"
[음반],[수입] Fireballs - Bottle Of Wine & Come On React,"24,900원"
[외국도서],React.Js for Busies (Paperback),"18,350원"
[국내도서],리액트 웹앱 제작 총론,"22,500원"
[외국도서],"Pro Mern Stack: Full Stack Web App Development with Mongo, Express, React, and Node (Paperback)","56,680원"
[외국도서],"Portable Literature + Lms Integrated Mindtap Literature, 1-term Access (Paperback, Pass Code, 9th)","125,930원"
[외국도서],Coping With Trouble (Hardcover),"86,100원"
[외국도서],"Portable Literature + 2016 Mla Update Card + Lms Integrated Mindtap English, 1 Term 6 Months Access Card (Paperback, 9th, PCK)","125,930원"
[외국도서],"Portable Literature + Mindtap Literature Access Card (Paperback, 9th, PCK)","153,650원"
[외국도서],"Portable Literature + Lms Integrated for Mindtap Literature, 1 Term 6 Months Access Card (Paperback, 9th, PCK)","153,650원"
[외국도서],"Compact Literature + Questia, 1 Term 6 Months Access Card (Paperback, 9th, PCK)","233,030원"
[외국도서],"Think, Read, React, Plan, Write, Rewrite (Paperback, 5th, Subsequent)","36,470원"
[외국도서],"Literature (Hardcover, 3rd)","64,190원"
[외국도서],Fiction (Paperback),"73,010원"
[외국도서],IM CHEMISTRY PRIN REACT 6E (Paperback),"54,920원"
[외국도서],Knowing About Performance Enhancing Drugs (Paperback),"8,500원"
[외국도서],"Literature: Reading, Reacting, Writing (with Lit21 CD-ROM Version 1.5) (Hardcover, 5th)","231,770원"
[외국도서],"Literature (Hardcover, 6th)","277,130원"
[외국도서],"Pattern Formation in Reacting Systems: Continuum Modeling, Experiments and Stochastic Simulations. (Paperback)","86,940원"
[외국도서],Stereograph React (Hardcover),"45,860원"
[외국도서],Computational Fluid Dynamics and Reacting Gas Flows (Hardcover),"113,650원"
[외국도서],How the World's News Media Reacted to 9/11 (Paperback),"57,340원"
[외국도서],Transport Processes in Chemically Reacting Flow Systems (Paperback),"28,640원"
[국내도서],Do it! 클론 코딩 영화 평점 웹서비스,"14,400원"
[국내도서],RxJS 프로그래밍,"28,800원"
[국내도서],리액트를 다루는 기술,"32,400원"
[국내도서],타입스크립트 퀵스타트,"28,800원"
[eBook],Vue.js 첫걸음,"17,600원"
[외국도서],React: QuickStart Manuel D'Apprentissage de la Bibliotheque React JavaScript (Paperback),"15,350원"
[외국도서],"Compact Literature + Lms Integrated Mindtap English, 1 Term 6 Months Access Card (Paperback, 9th, PCK)","125,930원"
[외국도서],"Portable Literature + 2016 Mla Update Card + Mindtap Literature, 1 Term 6 Months Access Card (Paperback, 9th, PCK)","125,930원"
[외국도서],"Compact Literature + 2016 Mla Update Card + Mindtap Literature, 1 Term 6 Months Access Card (Paperback, 9th, PCK)","125,930원"
[국내도서],프로 리액트,"25,200원"
[외국도서],Learning React: Functional Web Development with React and Redux (Paperback),"57,380원"
[외국도서],Turbulent Boundary Layers (Hardcover),"37,800원"
[외국도서],Earthquake (Library),"30,550원"
[외국도서],PWRLCTR CHEM PRIN REACT 6E,"2,237,760원"
[외국도서],"Literature: Reading Reacting Writing (Compact Fifth Edition) (Paperback, 5)","101,990원"
[외국도서],"Classroom Practice Exercises for Literature: Reading, Reacting, Writing (Paperback)","31,430원"
[외국도서],"Portable Literature: Reading, Reacting, Writing (Paperback, 8)","136,010원"
[외국도서],Nonlinear Differential Equations of Chemically Reacting Systems (Hardcover),"124,740원"
[외국도서],ACT and React: Worship Scripts for Chapel and Sanctuary (Paperback),"22,380원"
